{
  "$schema": "https://json-schema.org/draft/2020-12/schema",
  "$id": "https://transtyle.dev/schemas/config/v0.json",
  "title": "Transtyle config (transtyle.config.json)",
  "description": "Schema for a Transtyle project configuration file. See https://transtyle.dev/docs/configuration/.",
  "type": "object",
  "required": [
    "tokens"
  ],
  "additionalProperties": false,
  "properties": {
    "$schema": {
      "type": "string"
    },
    "name": {
      "type": "string"
    },
    "tokens": {
      "type": "array",
      "minItems": 1,
      "items": {
        "anyOf": [
          {
            "type": "string"
          },
          {
            "type": "object",
            "required": [
              "files"
            ],
            "anyOf": [
              {
                "required": [
                  "mode"
                ]
              },
              {
                "required": [
                  "override"
                ]
              }
            ],
            "additionalProperties": false,
            "properties": {
              "files": {
                "anyOf": [
                  {
                    "type": "string"
                  },
                  {
                    "type": "array",
                    "items": {
                      "type": "string"
                    }
                  }
                ]
              },
              "mode": {
                "type": "object",
                "additionalProperties": {
                  "type": "string"
                }
              },
              "override": {
                "enum": [
                  true,
                  "extend"
                ]
              }
            }
          }
        ]
      }
    },
    "modes": {
      "type": "object",
      "additionalProperties": {
        "type": "object",
        "required": [
          "values"
        ],
        "additionalProperties": false,
        "properties": {
          "values": {
            "type": "array",
            "minItems": 1,
            "items": {
              "type": "string"
            }
          },
          "default": {
            "type": "string"
          }
        }
      }
    },
    "bindings": {
      "type": "array",
      "items": {
        "type": "object",
        "required": [
          "slot",
          "from"
        ],
        "additionalProperties": false,
        "properties": {
          "slot": {
            "type": "string"
          },
          "from": {
            "type": "string"
          },
          "roles": {
            "type": "array",
            "minItems": 1,
            "items": {
              "type": "string"
            }
          },
          "required": {
            "type": "boolean"
          },
          "description": {
            "type": "string"
          }
        }
      }
    },
    "derivation": {
      "type": "object",
      "additionalProperties": false,
      "properties": {
        "rules": {
          "type": "string"
        },
        "autoDark": {
          "type": "boolean"
        },
        "require": {
          "type": "array",
          "items": {
            "type": "string"
          }
        }
      }
    },
    "units": {
      "type": "object",
      "additionalProperties": false,
      "properties": {
        "remBase": {
          "type": "string",
          "pattern": "^(?=.*[1-9])\\d+(\\.\\d+)?px$",
          "description": "What one rem is worth, as a positive px length such as \"16px\" (the default)."
        }
      }
    },
    "targets": {
      "type": "object",
      "additionalProperties": {
        "type": "object",
        "additionalProperties": false,
        "properties": {
          "output": {
            "type": "string"
          },
          "exporter": {
            "type": "string"
          },
          "options": {
            "type": "object"
          },
          "modes": {
            "type": "object",
            "additionalProperties": {
              "type": "array",
              "minItems": 1,
              "items": {
                "type": "string"
              }
            }
          }
        }
      }
    },
    "check": {
      "type": "object",
      "additionalProperties": false,
      "properties": {
        "failOn": {
          "type": "string",
          "enum": [
            "error",
            "warning",
            "approximation"
          ]
        },
        "suppress": {
          "type": "array",
          "items": {
            "type": "object",
            "required": [
              "code",
              "reason"
            ],
            "additionalProperties": false,
            "properties": {
              "code": {
                "type": "string",
                "pattern": "^TST[0-9]{4}$",
                "description": "a diagnostic code such as TST1305"
              },
              "path": {
                "type": "string",
                "pattern": "^[^*]+(\\.\\*)?$",
                "description": "an exact token path, or a prefix ending in .*"
              },
              "reason": {
                "type": "string",
                "minLength": 1,
                "pattern": "\\S"
              }
            }
          }
        },
        "contrast": {
          "type": "object",
          "additionalProperties": false,
          "properties": {
            "standard": {
              "type": "string",
              "enum": [
                "wcag21-aa",
                "wcag21-aaa"
              ]
            }
          }
        },
        "hygiene": {
          "type": "object",
          "additionalProperties": false,
          "properties": {
            "unusedOption": {
              "type": "string",
              "enum": [
                "info",
                "warning",
                "off"
              ]
            },
            "duplicateOption": {
              "type": "string",
              "enum": [
                "info",
                "warning",
                "off"
              ]
            }
          }
        }
      }
    }
  }
}
