{
  "$schema": "https://transtyle.dev/schemas/config/v0.json",
  "name": "glob-plus-overlay-fixture-overlay-first",
  "tokens": [
    { "files": "../tokens/dark.tokens.json", "mode": { "color-scheme": "dark" } },
    "../tokens/*.tokens.json"
  ],
  "modes": {
    "color-scheme": { "values": ["light", "dark"], "default": "light" }
  },
  "derivation": {
    "rules": "standard@1",
    "autoDark": false,
    "require": ["semantic.color.primary"]
  },
  "targets": {}
}
