{
  "$schema": "https://transtyle.dev/schemas/config/v0.json",
  "name": "bind-suggest-fixture",
  "tokens": [
    "tokens/vocabulary.tokens.json"
  ],
  "modes": {
    "color-scheme": {
      "values": [
        "light"
      ],
      "default": "light"
    }
  },
  "derivation": {
    "rules": "standard@1"
  },
  "targets": {
    "css-variables": {
      "output": "dist/css-variables"
    }
  }
}
