{
  "$schema": "https://transtyle.dev/schemas/config/v0.json",
  "name": "bindings-fixture",
  "tokens": [
    "tokens/option.tokens.json",
    "tokens/semantic.tokens.json"
  ],
  "bindings": [
    {
      "slot": "semantic.color.{role}.solid",
      "from": "{option.color.{role}.600}"
    },
    {
      "slot": "semantic.color.{role}.solid-hover",
      "from": "{option.color.{role}.700}"
    },
    {
      "slot": "semantic.color.{role}.tint",
      "from": "{option.color.{role}.50}"
    },
    {
      "slot": "semantic.color.{role}.on-solid",
      "from": "{option.color.white}",
      "roles": [
        "primary",
        "danger"
      ]
    },
    {
      "slot": "semantic.color.text.{rung}",
      "from": "{option.color.ink.{rung}}"
    },
    {
      "slot": "semantic.color.elevation.{level}.surface",
      "from": "{option.color.surface.{level}}"
    }
  ],
  "modes": {
    "color-scheme": {
      "values": [
        "light"
      ],
      "default": "light"
    }
  },
  "derivation": {
    "rules": "standard@1",
    "autoDark": false,
    "require": [
      "semantic.color.primary"
    ]
  },
  "targets": {
    "css-variables": {
      "output": "dist/css-variables"
    },
    "bootstrap": {
      "output": "dist/bootstrap"
    },
    "shadcn": {
      "output": "dist/shadcn",
      "options": {
        "era": "tailwind-v4"
      }
    }
  }
}
